Title,Page URL,Game URL,Cover Image,Rating,Content Path,Meta Title,Meta Description,Categories,Tags
Hollow Knight: Silksong,https://geometrylite.io/hollow-knight-silksong,https://itch.io/embed-upload/4927768,https://geometrylite.io/cache/data/image/game/hollow-knight-silksong/hollow-knight-silksong-m300x180.webp,8.3,content/hollow-knight-silksong.md,Hollow Knight: Silksong - Master Acrobatic Combat,"Explore a vast new kingdom in Hollow Knight: Silksong. Wield deadly new powers, craft tools, and battle 150+ new foes. Your acrobatic adventure awaits!","Action, Adventure, Platform","Skill, Fast-Paced, Jumping, Side Scrolling"
Geometry Dash: Dual Wave Editor,https://geometrylite.io/geometry-dash-dual-wave-editor,https://yandex.com/games/app/364479?utm_source=distrib&is-united-page=1&skip-guard=1&header=no&utm_medium=geometrylite.io&clid=10575041&flags=%7B%22adv_sticky_banner_disabled%22%3Atrue%7D,https://geometrylite.io/cache/data/image/game/geometry-dash-dual-wave-editor/geometry-dash-dual-wave-editor-m300x180.webp,6.5,content/geometry-dash-dual-wave-editor.md,Geometry Dash: Dual Wave Editor - Create & Survive!,Design and master impossible mirrored levels in Geometry Dash: Dual Wave Editor. Control two waves at once in this fan-made challenge. Play now in your browser!,"Geometry, Rhythm","Fan-Made, Wave, Creative, Hard, Music"
Cosmic Dash,https://geometrylite.io/cosmic-dash,https://html5.gamedistribution.com/4ddc9e3502334cfca08e06db4032f8ae/?gd_sdk_referrer_url=https://geometrylite.io/cosmic-dash,https://geometrylite.io/cache/data/image/game/cosmic-dash/cosmic-dash-3-m300x180.webp,10,content/cosmic-dash.md,Cosmic Dash - Master the High-Speed Asteroid Run,"Dodge, smash, and boost through a deadly cosmos in Cosmic Dash! Test your reflexes in this intense endless runner and chase the ultimate high score. Play now!","Arcade, Action","Endless Runner, Fast-Paced, Avoid, Space, Skill"
Flamewall Wave Challenge,https://geometrylite.io/flamewall-wave-challenge,https://turbowarp.org/992520883/embed,https://geometrylite.io/cache/data/image/game/flamewall-wave-challenge/flamewall-wave-challenge-m300x180.webp,5.9,content/flamewall-wave-challenge.md,Flamewall Wave Challenge - The Ultimate Rhythm & Wave Test,Test your reflexes in Flamewall Wave Challenge! Survive fiery passages in this intense fan-made game focused purely on wave skill. Play now and set a new record!,"Geometry, Rhythm","Fan-Made, Wave, Skill, Fast-Paced, Music"
Geometry Dash: Black Ball,https://geometrylite.io/geometry-dash-black-ball,https://st.8games.net/7/igra-geometri-dash-chjornyj-shar/,https://geometrylite.io/cache/data/image/game/geometry-dash-black-ball/geometry-dash-black-ball-m300x180.webp,10,content/geometry-dash-black-ball.md,Geometry Dash: Black Ball - Master Gravity-Flipping Action,Flip gravity with the Black Ball in a thrilling Geometry Dash spinoff! Dodge spikes and saws in a test of pure reflex. Play now for an intense challenge!,"Geometry, Platform, Rhythm","Fan-Made, Ball, Skill, Avoid, Music, Obstacle"
Geometry Craft 3D,https://geometrylite.io/geometry-craft-3d,https://st.8games.net/7/igra-geometriya-kraft-3d/,https://geometrylite.io/cache/data/image/game/geometry-craft-3d/geometry-craft-3d-m300x180.webp,8,content/geometry-craft-3d.md,Geometry Craft 3D - The Ultimate Blocky Dash Challenge,"Experience the ultimate mashup of Geometry Dash and Minecraft! Dash through 3D blocky worlds, dodge deadly traps, and test your reflexes. Play Geometry Craft 3D now!","Geometry, Arcade","3D, Fan-Made, Obstacle, Fast-Paced, Skill"
Geometry Dash Lava Mode,https://geometrylite.io/geometry-dash-lava-mode,https://st.8games.net/7/igra-geometri-desh-lava-mod/,https://geometrylite.io/cache/data/image/game/geometry-dash-lava-mode/geometry-dash-lava-mode-m300x180.webp,7.5,content/geometry-dash-lava-mode.md,Geometry Dash Lava Mode - Master the Fiery Wave Challenge,"Dodge, dip, and dive in Geometry Dash Lava Mode, a free fan-made game. Test your wave skills across intense levels filled with fiery obstacles. Play now!","Geometry, Rhythm","Fan-Made, Wave, Music, Hard, Skill"
Vex Hyper Dash,https://geometrylite.io/vex-hyper-dash,https://html5.gamedistribution.com/169c01c96fb5407680dfea26391d01d2/?gd_sdk_referrer_url=https://geometrylite.io/vex-hyper-dash,https://geometrylite.io/cache/data/image/game/vex-hyper-dash/vex-hyper-dash-4-m300x180.webp,7.5,content/vex-hyper-dash.md,Vex Hyper Dash - Master the Endless Platformer Gauntlet,"Dash, jump, and survive in Vex Hyper Dash! Test your reflexes in a fast-paced, endless platformer with a new dash mechanic. Play now for the ultimate test of skill!","Platform, Arcade","Endless Runner, Fast-Paced, Jumping, Skill, Obstacle"
Tung Tung Sahur in Geometry Dash,https://geometrylite.io/tung-tung-sahur-in-geometry-dash,https://html5.gamedistribution.com/154a56fa76ec432eaebcdc1f3a1ce8ba/?gd_sdk_referrer_url=https://geometrylite.io/tung-tung-sahur-in-geometry-dash,https://geometrylite.io/cache/data/image/game/tung-tung-sahur-in-geometry-dash/tung-tung-sahur-in-geometry-dash-3-m300x180.webp,6,content/tung-tung-sahur-in-geometry-dash.md,Tung Tung Sahur in Geometry Dash - Master the Wave!,"Dodge spikes and ride the rhythm in Tung Tung Sahur, the viral Geometry Dash wave challenge! Master neon-lit corridors and test your reflexes. Play now!","Geometry, Rhythm","Wave, Music, Neon, Skill, Fast-Paced"
Geometry Dash Polargeist v01,https://geometrylite.io/geometry-dash-polargeist-v01,https://turbowarp.org/446206348/embed,https://geometrylite.io/cache/data/image/game/geometry-dash-polargeist-v01/geometry-dash-polargeist-v01-m300x180.webp,10,content/geometry-dash-polargeist-v01.md,Geometry Dash Polargeist v01 - A Classic Level Reimagined,Jump into Geometry Dash Polargeist v01! Experience the classic 4-star Hard level with stunning new visuals and effects. Master the rhythm and conquer the course!,"Geometry, Rhythm, Platform","Fan-Made, Classic, Hard, Music, 3 Coins, Skill"
Hollow Knight: Silksong in Geometry Mod!,https://geometrylite.io/hollow-knight-silksong-in-geometry-mod,https://yandex.com/games/app/464079?utm_source=distrib&is-united-page=1&skip-guard=1&header=no&utm_medium=geometrylite.io&clid=10575041&flags=%7B%22adv_sticky_banner_disabled%22%3Atrue%7D,https://geometrylite.io/cache/data/image/game/hollow-knight-silksong-in-geometry-mod/hollow-knight-silksong-in-geometry-mod-m300x180.webp,4,content/hollow-knight-silksong-in-geometry-mod.md,Hollow Knight: Silksong Geometry Mod - Create Your Battles,"Unleash your creativity in Hollow Knight: Silksong Geometry Mod! Build, experiment, and stage epic battles with your favorite characters. Play free in your browser!","Casual, Simulation","Creative, Fan-Made, Meme"
Geometry Dash Mystery Dungeon,https://geometrylite.io/geometry-dash-mystery-dungeon,https://turbowarp.org/1143430983/embed,https://geometrylite.io/cache/data/image/game/geometry-dash-mystery-dungeon/geometry-dash-mystery-dungeon-m300x180.webp,10,content/geometry-dash-mystery-dungeon.md,Geometry Dash Mystery Dungeon - A Dashing RPG Adventure,Explore a pixel-art dungeon in Geometry Dash Mystery Dungeon! Master rhythmic challenges and enjoy a nostalgic tribute to classic RPGs. Play this 5-star level now!,"Geometry, Rhythm, Adventure","User Levels, Music, Pixel, Skill, Hard"
Geometry Dash Remake Level 2,https://geometrylite.io/geometry-dash-remake-level-2,https://turbowarp.org/443189507/embed,https://geometrylite.io/cache/data/image/game/geometry-dash-remake-level-2/geometry-dash-remake-level-2-m300x180.webp,10,content/geometry-dash-remake-level-2.md,Geometry Dash Remake Level 2 - A Classic Reimagined,"Jump into Geometry Dash Remake Level 2! Experience the fan-made reimagining of Back on Track with an icy theme, new visuals, and classic gameplay. Play now!","Geometry, Rhythm, Platform","Fan-Made, Classic, Music, Skill"
Geo Rush,https://geometrylite.io/geo-rush,https://yandex.com/games/app/425541?utm_source=distrib&is-united-page=1&skip-guard=1&header=no&utm_medium=geometrylite.io&clid=10575041&flags=%7B%22adv_sticky_banner_disabled%22%3Atrue%7D,https://geometrylite.io/cache/data/image/game/geo-rush/geo-rush-m300x180.webp,6.7,content/geo-rush.md,Geo Rush - Master This Intense Rhythm-Based Platformer,"Jump, fly, and dodge in Geo Rush, the ultimate free-to-play rhythm platformer. Test your reflexes across impossible levels. Can you beat the rush? Play now!","Geometry, Rhythm, Platform","Fast-Paced, Music, Skill, Flying, Jumping"
Geometry Dash BuTiTi,https://geometrylite.io/geometry-dash-butiti,https://turbowarp.org/996158781/embed,https://geometrylite.io/cache/data/image/game/geometry-dash-butiti/geometry-dash-butiti-m300x180.webp,10,content/geometry-dash-butiti.md,Geometry Dash BuTiTi - Master a Rhythmic Masterpiece,"Jump into Geometry Dash BuTiTi, a legendary 7-star level by JonathanGD. Master fast-paced gameplay, perfect music sync, and stunning visuals. Play it now!","Geometry, Rhythm","User Levels, Music, Hard, Skill, Fast-Paced"
Geometry Dash Blade of Justice,https://geometrylite.io/geometry-dash-blade-of-justice,https://2games.io/game/geometry-dash-blade-of-justice,https://geometrylite.io/cache/data/image/game/geometry-dash-blade-of-justice/geometry-dash-blade-of-justice-m300x180.webp,8,content/geometry-dash-blade-of-justice.md,Blade of Justice - Conquer a Legendary Extreme Demon,Face the iconic Geometry Dash Blade of Justice! Master precise timing and a clean design in this legendary Extreme Demon level. Can you survive the challenge?,"Geometry, Rhythm","Extreme Demon, Skill, Music, Demonlist"
Neon Leap,https://geometrylite.io/neon-leap,https://2games.io/game/neon-leap/,https://geometrylite.io/cache/data/image/game/neon-leap/neon-leap-m300x180.webp,8.8,content/neon-leap.md,Neon Leap - Master the Rhythm in this Addictive Jumper,"Swing, leap, and climb an endless neon tower in Neon Leap! Test your timing and precision in this minimalist arcade jumper. Can you reach the top? Play now!","Arcade, Casual","Neon, Jumping, Skill, Endless Runner, Music"
Geometry Dash ColorZ,https://geometrylite.io/geometry-dash-colorz,https://turbowarp.org/441145663/embed,https://geometrylite.io/cache/data/image/game/geometry-dash-colorz/geometry-dash-colorz-m300x180.webp,10,content/geometry-dash-colorz.md,Geometry Dash ColorZ - Master Rhythmic Rainbow Gameplay,"Conquer the vibrant, color-shifting world of Geometry Dash ColorZ! Sync your jumps to an epic soundtrack and master a dazzling Normal 3-star challenge. Play now!","Geometry, Rhythm","Fan-Made, Music, Normal, Colorful, 3 Coins"
Geometry Dash Back on Track RM,https://geometrylite.io/geometry-dash-back-on-track-rm,https://turbowarp.org/417999054/embed,https://geometrylite.io/cache/data/image/game/geometry-dash-back-on-track-rm/geometry-dash-back-on-track-rm-m300x180.webp,6.7,content/geometry-dash-back-on-track-rm.md,Geometry Dash Back on Track RM - Master the Classic Remix,"Jump into Geometry Dash Back on Track RM, a fan-favorite remix! Experience enhanced music sync, faster gameplay, and a perfect challenge. Can you beat the beat?","Geometry, Rhythm","Fan-Made, Classic, Music, Fast-Paced, Skill"
BLOODMONEY!,https://geometrylite.io/bloodmoney,https://bloodmoney.1games.io/,https://geometrylite.io/cache/data/image/game/bloodmoney/bloodmoney-game-m300x180.webp,8.8,content/bloodmoney.md,BLOODMONEY! - A Darkly Satirical Clicker Challenge,"How far will you go for cash? BLOODMONEY! is a horror clicker where every tap has a price. Unlock tools, test your morals, and see the consequences. Play now!","Clicker, Casual","Horror, Idle, Meme"
Geometry Dash Adrift,https://geometrylite.io/geometry-dash-adrift,https://turbowarp.org/653349560/embed,https://geometrylite.io/cache/data/image/game/geometry-dash-adrift/geometry-dash-adrift-m300x180.webp,10,content/geometry-dash-adrift.md,Geometry Dash Adrift - Master the Moody Mini-Challenge,"Dive into the dark, atmospheric world of Geometry Dash Adrift. Master tight mini-gameplay, conquer rhythm-based obstacles, and find 3 hidden coins. Play now!","Geometry, Rhythm","User Levels, Music, 3 Coins, Skill"
Geometry Dash Glitter Madness 2k15,https://geometrylite.io/geometry-dash-glitter-madness-2k15,https://turbowarp.org/1186262469/embed,https://geometrylite.io/cache/data/image/game/geometry-dash-glitter-madness-2k15/geometry-dash-glitter-madness-2k15-m300x180.webp,6.7,content/geometry-dash-glitter-madness-2k15.md,Glitter Madness 2k15 - A Classic Remix Challenge,"Test your skills on Glitter Madness 2k15, a fan-favorite remix of Stereo Madness. Face deceptive jumps, tight corridors, and an infamous wave. Play now!","Geometry, Rhythm","Fan-Made, Music, Wave, Hard, Skill"
A Shedletsky POV,https://geometrylite.io/a-shedletsky-pov,https://turbowarp.org/1192006075/embed,https://geometrylite.io/cache/data/image/game/a-shedletsky-pov/a-shedletsky-pov-m300x180.webp,9.8,content/a-shedletsky-pov.md,A Shedletsky POV - Unravel a Hilarious Roblox Myth,Step into a Roblox legend's shoes in A Shedletsky POV! Click to change the story and uncover the truth about 1x1x1x1 in this funny fan-made game. Play now!,"Casual, Adventure","Roblox, Meme, Fan-Made"
Geometry Dash End Of Line,https://geometrylite.io/geometry-dash-end-of-line,https://2games.io/game/geometry-dash-end-of-line/,https://geometrylite.io/cache/data/image/game/geometry-dash-end-of-line/geometry-dash-end-of-line-m300x180.webp,3.3,content/geometry-dash-end-of-line.md,Geometry Dash End Of Line - A Rhythmic & Stylish Finale,"Master the sleek, gray world of Geometry Dash End Of Line! Conquer this 3-star Normal level, find all coins, and enjoy gameplay synced to F-777's music. Play now!","Geometry, Rhythm","Music, Normal, 3 Coins, Skill"
Geometry Dash Dreamland,https://geometrylite.io/geometry-dash-dreamland,https://turbowarp.org/440339319/embed,https://geometrylite.io/cache/data/image/game/geometry-dash-dreamland/geometry-dash-dreamland-m300x180.webp,6.7,content/geometry-dash-dreamland.md,Geometry Dash Dreamland - Conquer the Classic Skill-Check,Master the tricky jumps and tight corridors of Geometry Dash Dreamland. A classic Hard 4-star level known for its deceptive design. Play now and test your skills!,"Geometry, Rhythm, Platform","Classic, Hard, Music, Skill, Obstacle"
Geometry Platformer,https://geometrylite.io/geometry-platformer,https://html5.gamedistribution.com/b072eec82dec4ad8b6fa3a602052e90b/?gd_sdk_referrer_url=https://geometrylite.io/geometry-platformer,https://geometrylite.io/cache/data/image/game/geometry-platformer/geometry-platformer-3-m300x180.webp,8.1,content/geometry-platformer.md,Geometry Platformer - Master a Neon Precision Challenge,Jump and dodge through deadly geometric levels in Geometry Platformer. Test your reflexes in this tough-as-nails precision platformer. Play free in your browser now!,"Platform, Arcade","Neon, Skill, Obstacle, Jumping, Fast-Paced"
Geometry Dash Level Easy,https://geometrylite.io/geometry-dash-level-easy,https://2games.io/game/geometry-dash-level-easy/,https://geometrylite.io/cache/data/image/game/geometry-dash-level-easy/geometry-dash-level-easy-m300x180.webp,7.8,content/geometry-dash-level-easy.md,Geometry Dash Level Easy - A Fun Start for Beginners,"Master your first iconic user level in Geometry Dash! 'Easy' offers simple controls, fun rhythm gameplay, and a perfect learning curve. Start your journey today!","Geometry, Rhythm","User Levels, Music, Skill"
Geometry Dash Sonar,https://geometrylite.io/geometry-dash-sonar,https://turbowarp.org/471676056/embed,https://geometrylite.io/cache/data/image/game/geometry-dash-sonar/geometry-dash-sonar-m300x180.webp,8.8,content/geometry-dash-sonar.md,Geometry Dash Sonar - Master the Rhythmic 2-Star Classic,Jump into Geometry Dash Sonar! Experience perfect music sync and iconic gameplay in one of the most downloaded levels ever. Find all 3 coins and conquer the classic!,"Geometry, Rhythm","User Levels, Music, Classic, 3 Coins, Normal"
Geometry Dash The Lightning Road,https://geometrylite.io/geometry-dash-the-lightning-road,https://turbowarp.org/274412484/embed,https://geometrylite.io/cache/data/image/game/geometry-dash-the-lightning-road/geometry-dash-the-lightning-road-m300x180.webp,10,content/geometry-dash-the-lightning-road.md,Geometry Dash The Lightning Road - Conquer Your First Demon,"Ride the lightning in The Lightning Road, an iconic Easy Demon! Master music-synced jumps, tight ship sequences, and conquer your first demon level today!","Geometry, Rhythm","Easy Demon, Music, Skill, Fast-Paced"
Geometry Dash Double Wave PRO,https://geometrylite.io/geometry-dash-double-wave-pro,https://st.8games.net/7/igra-geometriya-dash-dvojnaya-volna-pro/,https://geometrylite.io/cache/data/image/game/geometry-dash-double-wave-pro/geometry-dash-double-wave-pro-m300x180.webp,7.1,content/geometry-dash-double-wave-pro.md,Geometry Dash Double Wave PRO - Master the Dual Wave,Control two waves at once in Geometry Dash Double Wave PRO! Test your reflexes across 22 intense levels in this fan-made challenge. Play now and survive the chaos!,"Geometry, Rhythm","Fan-Made, Wave, Skill, Hard, Music"
Geometry Wave Сhallenge,https://geometrylite.io/geometry-wave-challenge-game,https://app-285614.games.s3.yandex.net/285614/sxr1ljuqqsktw5txnfkd2pa3cxdnndsp/index.html,https://geometrylite.io/cache/data/image/game/geometry-wave-shallenge/geometry-wave-challenge-game-m300x180.webp,10,content/geometry-wave-hallenge.md,Geometry Wave Сhallenge - A Pure Test of Reflex & Skill,"Conquer 5 intense levels in Geometry Wave Сhallenge, a minimalist arcade game focused on pure wave gameplay. Test your reflexes and master the rhythm. Play now!","Geometry, Rhythm","Fan-Made, Wave, Skill, Music"
Fireboy and Watergirl,https://geometrylite.io/fireboy-and-watergirl,https://webglmath.github.io/fireboy-and-watergirl-1/,https://geometrylite.io/cache/data/image/game/fireboy-and-watergirl-m300x180.webp,7.7,content/fireboy-and-watergirl.md,Fireboy and Watergirl - Play the Classic Co-op Puzzle Game,"Team up in Fireboy and Watergirl! Solve clever puzzles, master the elements, and escape the temple together. Play solo or with a friend on one keyboard now!","Puzzle, Adventure","2 Player, Collect, Classic, Skill"
Dinosaur Game,https://geometrylite.io/dinosaur-game,https://1games.io/game/t-rex/,https://geometrylite.io/cache/data/image/game/dinosaur-game-m300x180.webp,8.2,content/dinosaur-game.md,Dinosaur Game - Play The Classic Chrome T-Rex Runner,Jump over cacti and dodge pterodactyls in the official Dinosaur Game! Test your reflexes in this endless T-Rex runner. Play now and chase the high score!,"Arcade, Casual","Endless Runner, Pixel, Classic, Jumping, Skill"
MineFun.io,https://geometrylite.io/minefun-io,https://minefun.io/,https://geometrylite.io/cache/data/image/game/minefun-io/minefun-io-m300x180.webp,7.8,content/minefun-io.md,"MineFun.io - Build, Fight & Survive in Your Browser","Jump into MineFun.io! Experience creative building, survival, parkour, and intense PvP battles. Play free in your browser with no download required. Start now!","IO, Simulation","Multiplayer, Creative, Survival, 3D"
Geometry Dash Breeze,https://geometrylite.io/geometry-dash-breeze,https://1games.io/game/geometry-dash-breeze/,https://geometrylite.io/cache/data/image/game/geometry-dash-breeze-m300x180.webp,8.6,content/geometry-dash-breeze.md,Geometry Dash Breeze - Conquer the Fan-Favorite Demon Level,"Jump, fly, and dodge your way through Geometry Dash Breeze, a legendary fan-made level! Master rhythmic gameplay and a cool aesthetic. Play now and test your skills!","Geometry, Rhythm","Fan-Made, Demon, Music, Skill"
Geometry Dash Razorleaf,https://geometrylite.io/geometry-dash-razorleaf,https://turbowarp.org/910115875/embed,https://geometrylite.io/cache/data/image/game/geometry-dash-razorleaf/geometry-dash-razorleaf-m300x180.webp,7.6,content/geometry-dash-razorleaf.md,Geometry Dash Razorleaf - Conquer the Poison Gauntlet,Master the Geometry Dash Razorleaf (Poison) Gauntlet! Jump and fly through three epic neon levels with amazing music. Can you beat all three? Play now!,"Geometry, Rhythm","Gauntlets, Music, Neon, Skill, Hard"
Curve Rush 2,https://geometrylite.io/curve-rush-2,https://2games.io/game/curve-rush-2/,https://geometrylite.io/cache/data/image/game/curve-rush-2/curve-rush-2-m300x180.webp,9.3,content/curve-rush-2.md,Curve Rush 2 - Master Momentum & Soar to Victory,"Play Curve Rush 2! Dash and jump through ice, lava & night maps in this fast-paced arcade game. Time your release to master the physics and aim for a new high score!","Arcade, Casual","Physics, Speed, Skill, Jumping"
Geometry Jump 2,https://geometrylite.io/geometry-jump-2,https://games-online.io/game/GeometryJump2/,https://geometrylite.io/cache/data/image/game/geometry-jump-2/geometry-jump-2-m300x180.webp,6.6,content/geometry-jump-2.md,Geometry Jump 2 - Master Rhythmic Reflex Challenges,"Leap into the neon chaos of Geometry Jump 2! Test your timing with pulse-pounding music, impossible jumps, and new levels. Play now for free in your browser!","Geometry, Rhythm","Neon, Jumping, Music, Fast-Paced, Skill"
Geometry Dash Waves of Motion,https://geometrylite.io/geometry-dash-waves-of-motion,https://app-328648.games.s3.yandex.net/328648/0lr1tka8i7pm97t2w8j2td8o2ac8uhf0/index.html,https://geometrylite.io/cache/data/image/game/geometry-dash-waves-of-motion/geometry-dash-waves-of-motion-m300x180.webp,10,content/geometry-dash-waves-of-motion.md,Geometry Dash Waves of Motion - Master the Wave,Test your reflexes in Geometry Dash Waves of Motion! Conquer 9 levels of pure wave gameplay in this fan-made challenge. Play now and master precision control!,"Geometry, Rhythm","Fan-Made, Wave, Music, Skill"
Snow Rider 3D,https://geometrylite.io/snow-rider-3d,https://html5.gamedistribution.com/3b79a8537ebc414fb4f9672a9b8c68c8/?gd_sdk_referrer_url=https://geometrylite.io/snow-rider-3d,https://geometrylite.io/cache/data/image/snow-rider-3d-1-m300x180.webp,7.3,content/snow-rider-3d.md,Snow Rider 3D - Fast-Paced Endless Sleigh Racing Game,"Dodge obstacles and collect gifts in Snow Rider 3D, a thrilling endless runner! Unlock cool sleighs and test your reflexes. Play now for free in your browser!","Driving, Arcade","3D, Endless Runner, Collect, Skill"
Geometry Vibes 3D,https://geometrylite.io/geometry-vibes-3d,https://html5.gamedistribution.com/c0c42134197b4b018004ee6eed339851/?gd_sdk_referrer_url=https://geometrylite.io/geometry-vibes-3d,https://geometrylite.io/cache/data/image/game/geometry-vibes-3d/geometry-vibes-3d-3-m300x180.webp,8,content/geometry-vibes-3d.md,Geometry Vibes 3D - Free 3D Rhythm-Runner & 2-Player Fun,"Experience the classic rhythm-runner in a stunning 3D world! Dodge obstacles, master the beat, and challenge friends in 2-player mode. Play Geometry Vibes 3D now!","Geometry, Rhythm","3D, Music, 2 Player, Fast-Paced, Skill"
Black Geometry Wave Super Challenge,https://geometrylite.io/black-geometry-wave-super-challenge,https://app-293006.games.s3.yandex.net/293006/1a096htuvok8d3fe48oao4qkm4l3nwei/index.html,https://geometrylite.io/cache/data/image/game/black-geometry-wave-super-challenge/black-geometry-wave-super-challenge-m300x180.webp,8,content/black-geometry-wave-super-challenge.md,Black Geometry Wave Super Challenge - Master the Wave,Take on the ultimate fan-made wave challenge! Test your precision and rhythm in Black Geometry Wave Super Challenge across 8 intense levels. Play for free now!,"Geometry, Rhythm","Fan-Made, Wave, Music, Skill, Hard"
Geometry Lite Classic,https://geometrylite.io/geometry-lite-classic,https://2games.io/game/geometry-lite-classic/,https://geometrylite.io/cache/data/image/game/geometry-lite-classic-m300x180.webp,8.5,content/geometry-lite-classic.md,Geometry Lite Classic - The Ultimate Rhythm Challenge,"Jump, fly, and flip through rhythmic danger in Geometry Lite Classic! Master iconic levels in this fan-made web version. Test your reflexes and play now for free!","Geometry, Rhythm","Fan-Made, Classic, Music, Skill, Fast-Paced"
Deer Adventure,https://geometrylite.io/deer-adventure,https://2games.io/game/deer-adventure/,https://geometrylite.io/cache/data/image/game/deer-adventure/deer-adventure-m300x180.webp,8.9,content/deer-adventure.md,Deer Adventure - Unleash Chaotic Sandbox Destruction,"Play Deer Adventure, the hilarious physics sandbox game! Swing with a stretchy neck, fight kung fu sheep, and cause mayhem. Start your chaotic deer life today!","Simulation, Adventure, Casual","Physics, Ragdoll, Animal, Meme"
Geometry Dash Down Bass,https://geometrylite.io/geometry-dash-down-bass,https://turbowarp.org/276416640/embed,https://geometrylite.io/cache/data/image/game/geometry-dash-down-bass/geometry-dash-down-bass-m300x180.webp,5,content/geometry-dash-down-bass.md,Geometry Dash Down Bass - Conquer the Extreme Demon Wave,Face the ultimate rhythm challenge in Geometry Dash Down Bass. Master insane wave patterns and survive this iconic Extreme Demon level. Can you beat the bass?,"Geometry, Rhythm","Extreme Demon, Wave, Music, Skill, Demonlist"
Geometry Dash Hexagon Hyperdrive,https://geometrylite.io/geometry-dash-hexagon-hyperdrive,https://turbowarp.org/374376017/embed,https://geometrylite.io/cache/data/image/game/geometry-dash-hexagon-hyperdrive-m300x180.webp,8.5,content/geometry-dash-hexagon-hyperdrive.md,Geometry Dash Hexagon Hyperdrive - Master the Rhythm,"Jump and fly through Geometry Dash Hexagon Hyperdrive! Master fast-paced, rhythm-based gameplay synced to an iconic beat. Can you survive the challenge? Play now!","Geometry, Rhythm","Music, Fast-Paced, Skill, User Levels"
